{
  "contract_version": "gkos-retrieval-evaluation-reviewed-bundle/1.0.0-draft.1",
  "conformance_file": "conformance-fixture.json",
  "golden_toml_file": "golden-fixture.toml",
  "source_corpus_file": "source-corpus.json",
  "fixture_catalog_file": "fixture-catalog.json",
  "fixed_provider_file": "fixed-provider.json",
  "metric_computation_file": "metric-computation-fixture.json",
  "normalized_golden_digest": "sha256:f3de2536a3a6496aff6b4d6e7afca522cfd5e5b28b7b907a9b9e4d39ac1c8a9f",
  "source_corpus_digest": "sha256:1d99bb7d9c2522d71f7c2e2633517753098be6f2698586b248f18d99affc285d",
  "fixture_catalog_digest": "sha256:45addb4ab8b9634ffd22f2df099bc027a007130c11f109cb03c4e04ca38b5e16",
  "fixed_provider_digest": "sha256:7c28de4be4ad24a116d4f07d9b86ea9b38ab3298700ee1563f3b861026dd5b41",
  "environment_set_digest": "sha256:8269ad9e34b9704eaa724de4628d5667cb9ba4483ad08117a7a7549e202800c1",
  "baseline_digest": "sha256:0e46a9a83c55563ca33c41e98257455aca0c62ac46adb7b9b35c1abf6f3b9126",
  "metric_computation_fixture_digest": "sha256:6ea3a6b44d50efe60c2215a6bb30db60a5c29133474ddb0458c5ac4517c35e36",
  "projection_manifest_set_digest": "sha256:e7285d07af3027c290151f864b8e46e3b468bc89017b67b74af77970f621dea9",
  "result_origins": [
    {
      "contract_version": "gkos-retrieval-evaluation-result-origin/1.0.0-draft.1",
      "query_id": "active-policy-at-cutoff",
      "golden_query_digest": "sha256:dfb1955512a21923442bb4bea2115ec7b6756badc6d12c2a9744079694d360c9",
      "metric_case_id": "reviewed-active-policy-at-cutoff",
      "metric_case_digest": "sha256:e1cdb7c9b522a08a7c225e4f821aaa732649605883561245a4b14cd74ec248c0",
      "vault_fixture": "retrieval-temporal-v1",
      "environment_digest": "sha256:b965cf391983c88657eb68f8572aec6abbf3c94777b983858a7f99646d018fc9",
      "environment_member_digest": "sha256:5b65a126907ad0c368db74da904c905831d4dc7a8471b7b03a75ea0c95167d8d",
      "catalog_entry_digest": "sha256:707b6eff99f91ed10ab7a801f7c2d0307a3964b7fb8b6ec940134997cb41f58c",
      "corpus_fixture_digest": "sha256:b0fb7a5371896377cd51beaa239900a3d312e511a60dca63aca0beccae488cb0",
      "manifest_projection_id": "retrieval:1a1c2b87cc86787deacd8fcb",
      "manifest_projection_digest": "sha256:1a1c2b87cc86787deacd8fcbaad191b027fd883279f5c315391ad54e29445e93",
      "result_projection_id": "retrieval:303c359b2be3419abf646b9c",
      "result_projection_digest": "sha256:303c359b2be3419abf646b9cd038fbb03491951471af20939fcdca9048bfa133",
      "lexical_backend": "sqlite_lexical_scan",
      "provider_scenario_digest": "sha256:4ea1f809a8d4ba1da63bddaa3e791920674fa02ed119914751abe7d319bd5c50",
      "eval_schedule_digest": "sha256:3b955bc5c6cc35949a96778a00431703d96d74fa1477326639a9f15983f7838b",
      "eval_occurrence_ordinal": 1,
      "embedding_query_template_digest": "sha256:b1a421151ed5a475cafae5a39493b853dbca9d5695e888e372c98a5ab0467cb5",
      "reranker_query_oracle_digest": "sha256:0f67b3c807973e7c9dee3862ff781d085b1ab179b6b375a6848b4a7f42a4d653",
      "reranker_request_digest": "sha256:12eb7158e1ea8ebf2a1df4e026fd709df11183ff5172cc4a3dcd7d2f8484d627",
      "query_attempt_counters": {
        "contract_version": "gkos-retrieval-evaluation-query-attempt-counters/1.0.0-draft.1",
        "authority_input_snapshot_count": 1,
        "source_read_count": 1,
        "retrieval_sql_stage_count": 2,
        "vector_provider_call_count": 1,
        "vector_provider_item_count": 1,
        "rerank_provider_call_count": 1,
        "rerank_provider_item_count": 1,
        "ranking_call_count": 1,
        "confidence_call_count": 1,
        "citation_verification_count": 2,
        "metric_computation_count": 1,
        "counter_digest": "sha256:8d7f3b5575bc79396d4d13b3cd3ed161cfef2621adb430071181160e957f5759"
      },
      "public_result_digest": "sha256:2172a575c455c6fb0fc65db7ad003fc97ed6cfb3fd238fe000b71ed357eab7fc",
      "query_metrics_digest": "sha256:62948ca2008bc85bd77810586c6240352584d0ab5e5e155ca13096adcbf0d610",
      "origin_digest": "sha256:eaf05047fab695995886e8cd854d34e43cb8b02399aabcd6b71bab46d2683b61"
    },
    {
      "contract_version": "gkos-retrieval-evaluation-result-origin/1.0.0-draft.1",
      "query_id": "agent-note-authority",
      "golden_query_digest": "sha256:9ce19f737f1b0e37da980e931119cc9335cf9c1e1ce48f0ac71cbf64a42ba01b",
      "metric_case_id": "reviewed-agent-note-authority",
      "metric_case_digest": "sha256:2f703dc21a688ca3c8465ad3cec07f8b5b306cfb71dbbc19e8c873266459decb",
      "vault_fixture": "retrieval-basic-v1",
      "environment_digest": "sha256:5495b321c00cf564fd80fc923733e987848aa966f02a9b25bf397fad5a3a17cd",
      "environment_member_digest": "sha256:7b06a95527b2f7cc6a528ca327df7795c9b5fa45cb56ec289eb378ecb2190dbb",
      "catalog_entry_digest": "sha256:baf36768e4520041082ecb818c605c53a72663991ef90cf6e5b4c71f1b975794",
      "corpus_fixture_digest": "sha256:7183c8cea2658cdc00abf4cbbd4b002eb1f5b72f880db227f6a2bf379a1a039c",
      "manifest_projection_id": "retrieval:c0293ffedb06c10907a6ccca",
      "manifest_projection_digest": "sha256:c0293ffedb06c10907a6ccca8de2be6de51eb6e7de5f29ab838273d2ec69e7c1",
      "result_projection_id": "retrieval:3c4f6e38be8d0bf4e51a3113",
      "result_projection_digest": "sha256:3c4f6e38be8d0bf4e51a3113d3df05df04130ba2da879d3fab0e5ca56f62ef27",
      "lexical_backend": "sqlite_lexical_scan",
      "provider_scenario_digest": "sha256:79967d7c45626f435de6ef683d311f62765d0330a879e9af8dac999cb74df26b",
      "eval_schedule_digest": "sha256:e8043ce0decca6a04a32e6d971ca22e3fdcb5be54f5a4acaa244186b42346c87",
      "eval_occurrence_ordinal": 1,
      "embedding_query_template_digest": "sha256:cef84c7e7f9f80eb0b5526556eb1401f47fa44778cf9753e81559da934afe6f6",
      "reranker_query_oracle_digest": "sha256:48922dd13a4f726d0b61eecfeb9e60a3ba6d5d4a11a48576760a124663e12a68",
      "reranker_request_digest": "sha256:29e2661dcf0031b95b61f1d50bc15eee967958b6381dff42dfedf1e05209e6d4",
      "query_attempt_counters": {
        "contract_version": "gkos-retrieval-evaluation-query-attempt-counters/1.0.0-draft.1",
        "authority_input_snapshot_count": 1,
        "source_read_count": 1,
        "retrieval_sql_stage_count": 2,
        "vector_provider_call_count": 1,
        "vector_provider_item_count": 1,
        "rerank_provider_call_count": 1,
        "rerank_provider_item_count": 1,
        "ranking_call_count": 1,
        "confidence_call_count": 1,
        "citation_verification_count": 2,
        "metric_computation_count": 1,
        "counter_digest": "sha256:8d7f3b5575bc79396d4d13b3cd3ed161cfef2621adb430071181160e957f5759"
      },
      "public_result_digest": "sha256:7faf64493c390a6f9dca70117ec76a7337fa129ebd177676fddafcb152732b6b",
      "query_metrics_digest": "sha256:f87d27f115ea1b76be48273b92f1b44b45dff221d52bb82a92625f5e82aedd7d",
      "origin_digest": "sha256:d5034d5143b7e3d4f0823130af66619bde3b541f53b1b9fae7f8513d9854e282"
    },
    {
      "contract_version": "gkos-retrieval-evaluation-result-origin/1.0.0-draft.1",
      "query_id": "agent-note-citation-freshness",
      "golden_query_digest": "sha256:19805497058bf3f32f1066f90d2f4f430cb5073e41202562050570a1d23b423d",
      "metric_case_id": "reviewed-agent-note-citation-freshness",
      "metric_case_digest": "sha256:63957cbb92f39f913790f4a5b6b85d6fd78de9880369123d3ea2b488897411c2",
      "vault_fixture": "retrieval-basic-v1",
      "environment_digest": "sha256:5495b321c00cf564fd80fc923733e987848aa966f02a9b25bf397fad5a3a17cd",
      "environment_member_digest": "sha256:7b06a95527b2f7cc6a528ca327df7795c9b5fa45cb56ec289eb378ecb2190dbb",
      "catalog_entry_digest": "sha256:baf36768e4520041082ecb818c605c53a72663991ef90cf6e5b4c71f1b975794",
      "corpus_fixture_digest": "sha256:7183c8cea2658cdc00abf4cbbd4b002eb1f5b72f880db227f6a2bf379a1a039c",
      "manifest_projection_id": "retrieval:c0293ffedb06c10907a6ccca",
      "manifest_projection_digest": "sha256:c0293ffedb06c10907a6ccca8de2be6de51eb6e7de5f29ab838273d2ec69e7c1",
      "result_projection_id": "retrieval:3c4f6e38be8d0bf4e51a3113",
      "result_projection_digest": "sha256:3c4f6e38be8d0bf4e51a3113d3df05df04130ba2da879d3fab0e5ca56f62ef27",
      "lexical_backend": "sqlite_lexical_scan",
      "provider_scenario_digest": "sha256:79967d7c45626f435de6ef683d311f62765d0330a879e9af8dac999cb74df26b",
      "eval_schedule_digest": "sha256:e8043ce0decca6a04a32e6d971ca22e3fdcb5be54f5a4acaa244186b42346c87",
      "eval_occurrence_ordinal": 2,
      "embedding_query_template_digest": "sha256:0569477070d3ed05c33dd87942355c985173a80b853deb6a985cb751d8e186a6",
      "reranker_query_oracle_digest": "sha256:f6e328eaf7aa19b92023f51f744082b26e1e716eb7e9cdb7bb5611db8a0e339e",
      "reranker_request_digest": "sha256:cddbd3dc98ce05a460f874c2fbcb2e5629239d80bc56df83eff616feff066b1d",
      "query_attempt_counters": {
        "contract_version": "gkos-retrieval-evaluation-query-attempt-counters/1.0.0-draft.1",
        "authority_input_snapshot_count": 1,
        "source_read_count": 1,
        "retrieval_sql_stage_count": 2,
        "vector_provider_call_count": 1,
        "vector_provider_item_count": 1,
        "rerank_provider_call_count": 1,
        "rerank_provider_item_count": 1,
        "ranking_call_count": 1,
        "confidence_call_count": 1,
        "citation_verification_count": 2,
        "metric_computation_count": 1,
        "counter_digest": "sha256:8d7f3b5575bc79396d4d13b3cd3ed161cfef2621adb430071181160e957f5759"
      },
      "public_result_digest": "sha256:36e9e035981e6297ed388b3b5c4d2179fb6f39c9c959ba5bf3ce4e362f363718",
      "query_metrics_digest": "sha256:b84686f1d57c0a9b3fcce2ba570c5c55f4d074da43ab3eaf9b83a5d8999662cb",
      "origin_digest": "sha256:b228fdf41e671715dd56dccc34096a8c5af5a939b449a4f902dfc14a8ef49486"
    },
    {
      "contract_version": "gkos-retrieval-evaluation-result-origin/1.0.0-draft.1",
      "query_id": "agent-note-conflict-handling",